{
  "schema_version": 2,
  "status": "non-certifying",
  "command": "./integration/p12/reproduce.sh --quick",
  "started_at": "2026-10-21T17:08:37Z",
  "finished_at": "2026-10-21T17:12:17Z",
  "qualification": null,
  "fuzz": null,
  "reviews": null,
  "source": {
    "repository": "https://github.com/otuschhoff/rados-go.git",
    "identity": "content-addressed-artifacts",
    "artifacts": {
      "object.go": "e6d7b44162e5e207ca6ac83bfc79fa594ff54070dea4612fdcd1db9ed6116836",
      "read_into_test.go": "325c0aa9b788bfbc3ee94ed38c76743e34d4d0270351e36fdfd152085c247ee5",
      "receive_budget_integration_test.go": "109019a4e151613d1d9cabce23651910df7473a79e1279b4c0332157a0de1e24",
      "config.go": "63287e850b19c9a89cb89aa93306fcd1366d1615004a975ad6eb58d99bb2153c",
      "metadata.go": "0d05c62980408ce2659965c4c56e01fea0da98039c1bde1f9d8928df930f65e5",
      "go.mod": "82c5d6809f3e77a2b68f41462004584d9399946795a90c97654439bff5ab5cdb",
      "errors_test.go": "e27cf823a294ac5475384960d833e175e10ebda66f4b2aeb595765a9334b4bf7",
      "THIRD_PARTY_NOTICES": "7c36fce9f9ff6adfbf728b640ebff7c57dffe69c62ef07584cec894c7d35ecb1",
      "changes.go": "34106d934b1da23a751d78ef04899fb5edcf80aa73d8c235f0b57e95adc177e9",
      "LICENSE": "10d2b9ae287146e3523195935cd9e2b79658acb32a73e974d8072cfbd1e34f43",
      "Makefile": "f1a94919ed26f2d2b88609117af86259c1ef7cfcb2e4b90550c170cfd51a3da2",
      "config_fuzz_test.go": "33de5ab9fc68a9fdfeb1116c5a844ff9b96cf4ac7bbe5d08cad4907e66e0c7c3",
      "client.go": "84babbf3657b368580f1d4ef76f4722ffbab5917f106f244f586427cf6b52f08",
      "admin_test.go": "ccd2dd8e24ecd05e571acf6aeec4e83e06284a38d772b3975443326103cc578f",
      "go.sum": "aada9d87cdf1fc9761055ae34522bdc35421d952dcc19d6f5323dd2dc087333c",
      "README.md": "37a08d1e78bb050156e82b272f4b6e7cc4e826dd5f312ad321bdcdc7556a57bb",
      "enumeration_test.go": "1c601263d1ddb9d0834ab453d496ca6efafddafc918ba5c714f42d7f3c9db1dd",
      "doc.go": "029e90e8a1a61bb7e92db5d30d97c26c6adb73e4afc11ea22e1f7d82c30f3f6e",
      "coordination_test.go": "52718d25d9b231fe872a357c9872a1448333357c3f78709c964a00a910fdf834",
      "admin.go": "633e981154cf48ebfb297cc5e617227f50e52a0457786cdabaaa333888211ae5",
      "SPEC.md": "933fb55517ee2aaaa9d7eefb775c561f01638b033fa1f541a2f69b67972cdd67",
      "metadata_test.go": "6146819994fe384c311042e062a20ca6043c5ae865357feb32fe9cbebe366322",
      "snapshot.go": "17657e979c8e9f5214d6cfddcc6025c075d353b5a38d87121c85151664cc2271",
      "config_test.go": "b47ce1b64bb09a6b64b4621b517f0c452e71a4db32256bd0af878598e1113d49",
      "client_test.go": "4e26e6dd16fa4eb3f8550a73ab67a9dcb354807691ba50da9e4534088b454f03",
      "coordination.go": "eaede536b5373251f9b0c1f99f5cde2295afcf8e57c21491a7fbb77d80815430",
      "changes_test.go": "ac746f3f841f6d6b2fd1d9a1d492022f65ac18eb33148b46b9a86973e895ffb9",
      "p12_diagnostics.go": "0b1bf86bddaf575a49597d3816a64517b01411ff8a7d763cf8b1c148d76286a0",
      "SECURITY.md": "38c8479cd9dc70540c09e38957302a3e0c892d45b8622e4a933eb30a780813d9",
      "errors.go": "907595385103cfb141d794ef3f8688d436ac13804858e48d0faec82b2855694b",
      "internal/maps/placement_reuse_test.go": "9dfd26640045ab30aa01a30b3524653655177df1478d6f00c242c0922ae1affc",
      "internal/maps/incremental_test.go": "6128818955e8e133c384b52645c98a6b38219e328fb986d7affe97ac03f6c05c",
      "internal/maps/monmap.go": "78bdda912e05c548ce55e827214dbedd0fe87e1e25cc0d5eb05edcf95c6979fb",
      "internal/maps/mgrmap.go": "32cad6af44c53081e24e417ce4de180fbc3fd72ddd270f12afe99b06b5d26b86",
      "internal/maps/osdmap_test.go": "3d2a5cf1aa5f9caa16d18fbbb58907f84a94f9677a66954f11f7f7edee4324fa",
      "internal/maps/mgrmap_test.go": "c5a092832cbbf117ffdafa333c7da553f2747b0a183806a15fdbeb9428797081",
      "internal/maps/monmap_test.go": "a40babf7628a12698984a674e6eecf83b5fafcde65ebd9201953d80ae0d194b7",
      "internal/maps/osdmap.go": "bbf99f2c731911d8e26feeb912546926bc9cfb903aa60bdf0717a0ea87016c38",
      "internal/maps/placement_test.go": "96313b4783e2141560bae963c5f248473504c06358481275c9f245bf2d4b9f0f",
      "internal/maps/performance_baseline_test.go": "55aa8eb4ee95ac69ecbe5fce23e43a27f4fbf2c3117956440737f30c11b59b84",
      "internal/maps/incremental.go": "de8687f425d1ceecb279e3e6efe05ae190e2a5189ec0a5ec845eae24363383f4",
      "internal/maps/p04_fixture_test.go": "98953880e9e9d7633d0ad10206491523f223125698fffa788616035245ac7088",
      "internal/maps/pool_test.go": "ad8ca192e7c4140fa901a36f4b68a8094fa6db3e7be854a6423e67686517f34c",
      "internal/maps/pool.go": "288ccdd4715dbc4a1ff8bcb936fc84ddd4d0c873138154ec9ec8fcabe0e86aea",
      "internal/maps/placement.go": "3a66eadafb7fac7cc42b77329326e5ce8b1fbe98aa3e2d2191ba3b9c4f7de0f5",
      "internal/osd/enumeration.go": "265f141c9f61a984279c7b0cbea86a09535e06bfcf13b544c253206e4235e086",
      "internal/osd/metadata.go": "7ea4eae91a47bc32dde896927c24b4ae5996bd4b258ba8da574ac2ea0b7854c7",
      "internal/osd/checksum_test.go": "fe81835356512544e5eee3b3f6936095c4e219e0f9f53d733c9b1da1068036bd",
      "internal/osd/command.go": "618fc109bf585513486b2d87d99b9077d61743763b1a2e077aca7e7d6772235e",
      "internal/osd/checksum.go": "6a69191fe84993c7890f628cee1b80764370eeb9ca300b57034b7c0fbd886eac",
      "internal/osd/messages_test.go": "cc7e67f3bed18ef05170fb5c71d3fd9d8af1e8413e80934356a21c0787bccd9b",
      "internal/osd/request_encoding_test.go": "cc9bebbc17c6ee4863a532ef5ba5f68434d619a586942855e17e1ad8b1ac362e",
      "internal/osd/backoff_test.go": "17ae2cf89f4a0c2f26cf0f77f75b3acf84c53d671b159b188d6be0c6f7cc2184",
      "internal/osd/backoff.go": "d1680258d65be03b1274775f79050f46602db3b9f947643460b48a83b7ed7255",
      "internal/osd/command_test.go": "8b9f23562e54a05bd2a071e51539c927f6696f98b112c59159a30e57f63e85bc",
      "internal/osd/messages_benchmark_test.go": "c2cbc2b6b6ed3e3a7132e66d31a7b899fe7d35d06dce56a9d9d4af46ff2f1f79",
      "internal/osd/lock_test.go": "589e16d31eafd31974bb299040df12211077eb71c22fb275d33ae7d5caed6a18",
      "internal/osd/inconsistent_test.go": "148f317aa69a53a20c904d9ec74248bc4d2e5dc47888acc1e3389c490736c9df",
      "internal/osd/enumeration_test.go": "820019051633ea5f82d3432585b50502e57f9310d8cd75b83f27b6fde524e2fb",
      "internal/osd/sparse.go": "e0eb31cc118754243633ea9b817ee4396759a6722a0a38a78505a62c4f434610",
      "internal/osd/messages.go": "8a5452d6a1cdc215dbfb1062006cb35b9d45d60f843ec3cb66fa55f23c74f71b",
      "internal/osd/lock.go": "bfdeb9bc9a5285dddd44d82ffa65eedb95cccb601996ca34851ac361b6f6d7f5",
      "internal/osd/watch_test.go": "2b88365eb4360f07cda270196ce09654d4e0f280e0a99af15cb3018804ee1943",
      "internal/osd/metadata_test.go": "4421879d22d3543071cf3a5e29fa14a77ff482270220de2b57b201b640fa512c",
      "internal/osd/sparse_test.go": "01ba7f17d2af91e7eba85786f3890788828479221d89dc2447af62ac00adf3d5",
      "internal/osd/inconsistent.go": "8e8ad9e80680f75d09da560edc7acee7faa1b11a4f1a7b411c905502b23c3e7c",
      "internal/osd/watch.go": "db74670ec4810a0b189c459b608d5161e5f0423aa0bb091f72af664a9f2c8ff6",
      "internal/objecter/read_into_test.go": "675bc8fca66ddfae49e8c0b8b135f2be41213cdadf126fe09a377fb7da0baefc",
      "internal/objecter/session_lifecycle_test.go": "b25022f8a4c4f8b64646905f38c30d61b063fc73189542107bbffcb279609522",
      "internal/objecter/command.go": "b903701eefab72b5423d2f02bc6fa3e21101aa86b1eb5fb7f391c5e970eee12a",
      "internal/objecter/command_test.go": "d25057f9a936e7e08629b9c1f72abd8dbbc4fc7e6cf49a18568d5c9d0396a051",
      "internal/objecter/session_creation_test.go": "14851dcd003cd782750452e457802fa588ca0269ee3afc5e1bfaca0a5a35b7f9",
      "internal/objecter/client.go": "2c3e108413bf9b51781b72f4ef8ba028c2997b5444fc2474136c5cad34568780",
      "internal/objecter/mutation_test.go": "e2a9822e98eccb284ba52de41993789c7115f3e72b0f1818ce1067022b47b963",
      "internal/objecter/mutation.go": "6ce627f30079f5efe3177ec57a3e481d282973810869a652432bdd63e66f0f6d",
      "internal/objecter/enumeration_test.go": "c9ebd319250f34d47bbdf2a4961394c02380f3671af5768494081ce0715b4be4",
      "internal/objecter/osd_session.go": "5286440fe28ee636fcd01028dfad3ecaf6d6cdd0d67849ca805b438b8844130e",
      "internal/objecter/backoff_control_test.go": "a04d72b21ddf236d94b4ea7041a2be2e468456a114a0524b8645d68f05dbfa41",
      "internal/objecter/watch_test.go": "913957f47cee2e898e5debde6211e4d458fe86853734326adfe0a7fb7c9fbc55",
      "internal/objecter/read_ownership_test.go": "84751657895b9f7cc6920a5cf95a0637854249fb260520e3c36ce229eacf1ee7",
      "internal/objecter/osd_session_test.go": "2cfcb730e79ccdf0626dfe4612302b60e9e3893c2b0d5517e9e04eb1c97b43e1",
      "internal/objecter/inconsistent.go": "653be7a65a48ca4921bc42e76fd9f04e3f48a2ab36220bf6a0a9defc100384a4",
      "internal/objecter/client_test.go": "04bffa704b8b4d4c8d9f913c14a2770dfdfad8f01d26032e0155d35cc036a072",
      "internal/objecter/backoff_burst_benchmark_test.go": "cadd535b261074599b04009150b7af004e4ec6f613a77808b1f21761e611585b",
      "internal/objecter/watch.go": "d44d0ade256a74fbde78d91e251b9c8520419a85eea218b84dd011890990f2cd",
      "internal/encoding/ownership_test.go": "83a7fc42a923faaea2eaae672c8ef659145681075b582f14001e5343a93606a2",
      "internal/encoding/crc.go": "9dce38e0846c80679a7182baeca6d4bd44a853b0a7841a507caa0a46675e9938",
      "internal/encoding/codec_test.go": "ac3316834d1f0bb1bb2633f5c777c70b082f55bd3a14057f5e14772039cbcfc5",
      "internal/encoding/codec_benchmark_test.go": "5ecc7c8ba2a14c8baf9917d8e39e3c294f6d141a99e8438ba7d7e729cba6784c",
      "internal/encoding/codec.go": "3f03d3783293a49d5de4986f28c615532cc54722fd5d4797448f883b683de550",
      "internal/protocol/protocol_test.go": "2fd9418c3c3f6324ca9b65350b1857c990d89c9a184c0e91f0072d26f956ce68",
      "internal/protocol/errno.go": "853b8360670a28e8462d6e2eeb3c7d427e9dacf98fe9752b5da2bfad71baafcd",
      "internal/protocol/address.go": "802b49d86bda957c9f243ef9b619a57f49441b108b0e69cf8c814cbb4eb5c686",